PublisherID,Name,Address,Phone,Email
1,天开科技有限公司,青海省合肥县上街王路y座 678592,13537453085,vcheng@lei.cn
2,彩虹科技有限公司,贵州省刚县东城崔路d座 509896,18186529539,xianglei@ua.cn
3,浙大万朋网络有限公司,江苏省桂香市怀柔李路k座 269469,13629698403,zhufang@qiang.cn
4,图龙信息网络有限公司,黑龙江省长沙市璧山呼和浩特路H座 567133,15984772720,liaoping@wencao.cn
5,飞海科技传媒有限公司,台湾省沈阳市白云邯郸路N座 554737,13623429259,taobai@jia.cn
6,易动力科技有限公司,山西省海口市友好刘路C座 598094,18754517259,exie@ping.cn
7,富Q信息有限公司,福建省龙县璧山梧州街L座 573815,15597345313,min14@xiagong.cn
8,昊嘉科技有限公司,天津市杭州市长寿南京路i座 245058,18865702277,nayang@18.org
9,昊嘉传媒有限公司,云南省巢湖市涪城沈阳路z座 128120,15648511774,xiulantang@min.cn
10,浦华众城科技有限公司,香港特别行政区贵阳县永川贺街F座 749661,13433020910,huangjing@09.cn
11,时刻科技有限公司,江苏省沈阳县西夏陈街E座 270738,13777567491,chenguiying@li.cn
12,惠派国际公司信息有限公司,云南省石家庄县萧山香港路X座 246352,13622695697,zhengna@cai.cn
13,晖来计算机科技有限公司,新疆维吾尔自治区沈阳市锡山太原街N座 845176,18518431147,gongna@pingchang.cn
14,方正科技网络有限公司,云南省兴安盟市永川呼和浩特街c座 295215,18794578050,qiang63@yongqiang.org
15,快讯传媒有限公司,河北省玉县丰都澳门街y座 272146,15268351219,caojuan@uj.com
16,MBP软件网络有限公司,陕西省天津县沙湾沈阳街M座 228998,13055274300,fang44@xiulanfang.cn
17,精芯传媒有限公司,天津市建华市清城李路v座 877562,18962070571,gdu@14.cn
18,泰麒麟信息有限公司,上海市柳州市魏都福州路k座 956470,15174312161,ming86@chenfu.cn
19,网新恒天网络有限公司,西藏自治区欢县房山虞街G座 988991,13863328844,xia68@ur.cn
20,双敏电子网络有限公司,青海省东县六枝特左街B座 714649,13657204162,guiying87@01.cn
21,快讯信息有限公司,广西壮族自治区海门市城北乌鲁木齐路s座 586622,15064031965,yanlei@pingna.cn
22,合联电子科技有限公司,湖北省娜县上街辽阳街s座 754111,18130885198,dgao@uy.cn
23,惠派国际公司传媒有限公司,广西壮族自治区沈阳县徐汇李街m座 938367,14709182507,leishen@liao.cn
24,恒聪百汇网络有限公司,辽宁省勇市南湖大冶路J座 440025,18902760372,yanwei@qiang.org
25,同兴万点科技有限公司,山东省巢湖市安次郭路q座 966231,15789803260,bpan@chaogang.cn
26,思优网络有限公司,宁夏回族自治区成都市静安乌鲁木齐路b座 756249,15647161532,yong61@taomin.cn
27,和泰科技有限公司,河南省建平县金平关岭街O座 117303,15187392467,weiguo@mingtao.cn
28,通际名联网络有限公司,台湾省洁市花溪东莞街J座 997920,15656540530,guiying81@tangding.org
29,东方峻景科技有限公司,新疆维吾尔自治区桂兰县东丽六安路C座 699838,18039276143,lina@gang.cn
30,济南亿次元科技有限公司,甘肃省合山县蓟州刘街y座 109016,13380242893,xiulan35@pingzou.cn
